{
  "documentType": "d2p:inspect-3d-edit-result",
  "schemaVersion": "1.0.0",
  "inspectionId": "ier_golden-tshirt-3d-r1-size-a-edits",
  "createdAt": "2026-01-07T00:00:00Z",
  "sceneSnapshotRef": {
    "id": "ssn_golden-tshirt-3d-r1-size-a",
    "digest": "sha256:181351cc6ac1181b42d99aa200c014be7a8c53399542a9c6260e239e916032fa"
  },
  "basePatternRef": {
    "artifactId": "art_golden-tshirt-pattern",
    "revisionId": "rev_golden-tshirt-pattern-r1"
  },
  "edits": [
    {
      "editId": "edit-1",
      "target": {
        "panelInstanceId": "panel-sleeve-left",
        "edgeId": "sleeve-underarm-front"
      },
      "delta": {
        "kind": "d2p:edge-length-change",
        "deltaMm": 30
      },
      "classification": "supported",
      "parameterUpdates": [
        {
          "parameterId": "sleeve-length",
          "expr": {
            "op": "add",
            "args": [
              {
                "op": "mul",
                "args": [
                  {
                    "op": "measurement",
                    "key": "arm-length"
                  },
                  {
                    "op": "literal",
                    "value": 0.33,
                    "unit": "1"
                  }
                ]
              },
              {
                "op": "literal",
                "value": 30,
                "unit": "mm"
              }
            ]
          }
        }
      ],
      "message": "Maps to sleeve-length (+30 mm); both sleeves change, because they are cut from one piece."
    },
    {
      "editId": "edit-2",
      "target": {
        "panelInstanceId": "panel-front",
        "edgeId": "front-side-left"
      },
      "delta": {
        "kind": "d2p:edge-length-change",
        "deltaMm": 15
      },
      "classification": "ambiguous",
      "parameterCandidates": [
        "armhole-depth",
        "body-length"
      ],
      "message": "The side seam length depends on more than one parameter; choose one."
    },
    {
      "editId": "edit-3",
      "target": {
        "panelInstanceId": "panel-back"
      },
      "delta": {
        "kind": "d2p:free-deformation"
      },
      "classification": "forbidden",
      "reasonCode": "d2p:free-deformation-not-invertible",
      "message": "A free surface deformation has no lossless inverse to a pattern; no proposal is made."
    }
  ],
  "proposalRef": {
    "id": "ppr_golden-tshirt-3d-r1-size-a-sleeve-length",
    "digest": "sha256:f051f4cc1211bc828e9052ae2e2c946a1a2ae1cbe1bc99bbc8b026cf6ad8661d"
  },
  "diagnostics": [],
  "resultDigest": "sha256:8be5c1cd3ce2731d92f40cc5d22adfaf9dd4dd1c9ac28649ccb89ab442efb36d"
}
